{
  "schema": 1,
  "gateId": "react-native-android",
  "commit": "414c1a14c7d60e1127a7738834e995020366fed0",
  "startedAt": "2026-07-31T22:28:57.878068Z",
  "finishedAt": "2026-07-31T22:29:49.990883Z",
  "executor": {
    "os": "linux",
    "architecture": "x86_64"
  },
  "targetOs": "android-emulator",
  "architectures": [
    "x86_64"
  ],
  "fixture": "examples/react-native-fixture",
  "command": [
    "bash",
    "validation/backends/with-appium.sh",
    "bash",
    "validation/backends/run-react-native-android.sh"
  ],
  "status": "passed",
  "exitCode": 0,
  "checks": {
    "EXPLORE:STATE ": true,
    "EXPLORE:EDGE ": true,
    "JOURNEY DONE": true,
    "All tests passed": true
  },
  "resetStrategy": "fresh pinned release application install on a boot-complete emulator",
  "cleanupStrategy": "generated application directory removed by EXIT trap",
  "logSha256": "a5c71ea88b56c93a4ab293973e7d69633a81e579dd7c6515c088f77ad6918d03",
  "logPath": "/evidence/react-native-android.log"
}
