{
  "schema": 1,
  "gateId": "windows-uia",
  "commit": "79e178175a4de92f07eb4b7cb3c6714b0ec2f824",
  "startedAt": "2026-08-01T01:48:15.492365Z",
  "finishedAt": "2026-08-01T01:57:25.597562Z",
  "executor": {
    "os": "windows",
    "architecture": "amd64"
  },
  "targetOs": "windows-x86_64-interactive",
  "architectures": [
    "x86_64"
  ],
  "fixture": "examples/wpf-fixture, examples/avalonia-fixture, examples/winui-fixture",
  "command": [
    "powershell",
    "validation/backends/run-windows-desktop.ps1"
  ],
  "status": "passed",
  "exitCode": 0,
  "checks": {
    "Windows DesktopUia backend passed WPF, Avalonia, and WinUI": true
  },
  "resetStrategy": "fixture process cleanup, fresh builds, and an interactive Windows session",
  "cleanupStrategy": "fixture process and temporary artifact cleanup",
  "logSha256": "ecd107c8f6b8318db98f9a9f3b566edd3f2245f7bc767ee9c6565ac2dc948b49",
  "logPath": "C:\\lab\\evidence-79e178175a4d\\windows-uia.log"
}
