{
  "schema": 1,
  "gateId": "macos-ax",
  "commit": "79e178175a4de92f07eb4b7cb3c6714b0ec2f824",
  "startedAt": "2026-08-01T02:05:36.090348Z",
  "finishedAt": "2026-08-01T02:05:49.143830Z",
  "executor": {
    "os": "darwin",
    "architecture": "arm64"
  },
  "targetOs": "macos",
  "architectures": [
    "arm64"
  ],
  "fixture": "examples/macos-swiftui-fixture",
  "command": [
    "bash",
    "validation/backends/run-macos-ax.sh"
  ],
  "status": "passed",
  "exitCode": 0,
  "checks": {
    "EXPLORE:STATE ": true,
    "EXPLORE:EDGE ": true,
    "JOURNEY DONE": true,
    "All tests passed": true
  },
  "resetStrategy": "fresh fixture build and bounded launch readiness",
  "cleanupStrategy": "fixture process terminated and temporary directory removed by EXIT trap",
  "logSha256": "cc54b8c0b157a6031e0784cdde9d397832a48ec783c5cbf533404fd44e188638",
  "logPath": "target/reproit-validation/macos-ax-exact-79e178175a4d/macos-ax.log"
}
