{
  "schema": 1,
  "gateId": "compose-android",
  "commit": "1091520c930c073abacbf33f4c100561638b2402",
  "startedAt": "2026-07-29T15:37:46.058200Z",
  "finishedAt": "2026-07-29T15:38:19.497562Z",
  "executor": {
    "os": "linux",
    "architecture": "x86_64"
  },
  "targetOs": "android-emulator",
  "architectures": [
    "x86_64"
  ],
  "fixture": "examples/compose-fixture",
  "command": [
    "bash",
    "validation/backends/with-appium.sh",
    "bash",
    "examples/compose-fixture/compose-appium-smoke.sh"
  ],
  "status": "passed",
  "exitCode": 0,
  "checks": {
    "EXPLORE:STATE ": true,
    "EXPLORE:EDGE ": true,
    "JOURNEY DONE": true,
    "All tests passed": true
  },
  "resetStrategy": "fixture rebuild, reinstall, force-stop, and explicit launch",
  "cleanupStrategy": "temporary fuzz configuration removed by EXIT trap",
  "logSha256": "5d101e4b04e4c818ad3c6237e5c19e29a1bf216d807d9b80e41dfdbe81dbb3dd",
  "logPath": "/evidence/compose-android.log"
}
